artist	artistId	album	albumId	date	song	songId
UNKLE	2nszamLjZFgu3Yx77mKxuC	The Answer EP	6BMwPyCX1GJLpHiMA5Rnyh	2010-09-14	The Answer (feat. Big in Japan (Baltimore) )	7FJ6UaLjaMbkGFWuvOiwtc
UNKLE	2nszamLjZFgu3Yx77mKxuC	The Answer EP	6BMwPyCX1GJLpHiMA5Rnyh	2010-09-14	Separate Half (feat. Lumerians with Rebecca Coseboom)	64qYBkBweO6ufIZb60LdI4
UNKLE	2nszamLjZFgu3Yx77mKxuC	The Answer EP	6BMwPyCX1GJLpHiMA5Rnyh	2010-09-14	Country Tune (feat. Gavin Clark)	3uCEyJHMKagtyDogMzEiOW
UNKLE	2nszamLjZFgu3Yx77mKxuC	The Answer EP	6BMwPyCX1GJLpHiMA5Rnyh	2010-09-14	The Runaway: Lupe's Revenge (Lupe Fiasco vs. Unkle Reconstruction)	3j3q9GJ2hBeDWomhRAqrBN
UNKLE	2nszamLjZFgu3Yx77mKxuC	The Answer EP	6BMwPyCX1GJLpHiMA5Rnyh	2010-09-14	Follow Me Down (Tim Goldsworthy Remix) [feat. Sleepy Sun]	5fKZq6vGUSuCjZCTBGcJ5q
UNKLE	2nszamLjZFgu3Yx77mKxuC	The Answer EP	6BMwPyCX1GJLpHiMA5Rnyh	2010-09-14	Heavy Drug (Reprise)	0p9fZAJnbPzOsVc54P69uS